{
  "gegenereerd": "2026-10-23T08:08:02+02:00",
  "tijdzone": "Europe/Amsterdam",
  "van": "2026-10-22T00:00:00+02:00",
  "tot": "2026-10-23T00:00:00+02:00",
  "interval": "PT15M",
  "eenheid": "GW",
  "bronnen": {
    "zon": "NED.nl, zonne-energie",
    "wind": "NED.nl, wind op land en wind op zee",
    "verbruik": "NED.nl, elektriciteitsvraag"
  },
  "punten": [
    {
      "t": "2026-10-22T00:00:00+02:00",
      "zon": 0,
      "wind": 10.012,
      "verbruik": 12.373
    },
    {
      "t": "2026-10-22T00:15:00+02:00",
      "zon": 0,
      "wind": 10.052,
      "verbruik": 12.151
    },
    {
      "t": "2026-10-22T00:30:00+02:00",
      "zon": 0,
      "wind": 10.098,
      "verbruik": 11.927
    },
    {
      "t": "2026-10-22T00:45:00+02:00",
      "zon": 0,
      "wind": 10.098,
      "verbruik": 11.773
    },
    {
      "t": "2026-10-22T01:00:00+02:00",
      "zon": 0,
      "wind": 10.013,
      "verbruik": 11.622
    },
    {
      "t": "2026-10-22T01:15:00+02:00",
      "zon": 0,
      "wind": 9.934,
      "verbruik": 11.459
    },
    {
      "t": "2026-10-22T01:30:00+02:00",
      "zon": 0,
      "wind": 9.833,
      "verbruik": 11.338
    },
    {
      "t": "2026-10-22T01:45:00+02:00",
      "zon": 0,
      "wind": 9.683,
      "verbruik": 11.195
    },
    {
      "t": "2026-10-22T02:00:00+02:00",
      "zon": 0,
      "wind": 9.562,
      "verbruik": 11.066
    },
    {
      "t": "2026-10-22T02:15:00+02:00",
      "zon": 0,
      "wind": 9.55,
      "verbruik": 10.904
    },
    {
      "t": "2026-10-22T02:30:00+02:00",
      "zon": 0,
      "wind": 9.442,
      "verbruik": 10.812
    },
    {
      "t": "2026-10-22T02:45:00+02:00",
      "zon": 0,
      "wind": 9.453,
      "verbruik": 10.776
    },
    {
      "t": "2026-10-22T03:00:00+02:00",
      "zon": 0,
      "wind": 9.481,
      "verbruik": 10.741
    },
    {
      "t": "2026-10-22T03:15:00+02:00",
      "zon": 0,
      "wind": 9.52,
      "verbruik": 10.701
    },
    {
      "t": "2026-10-22T03:30:00+02:00",
      "zon": 0,
      "wind": 9.553,
      "verbruik": 10.666
    },
    {
      "t": "2026-10-22T03:45:00+02:00",
      "zon": 0,
      "wind": 9.492,
      "verbruik": 10.653
    },
    {
      "t": "2026-10-22T04:00:00+02:00",
      "zon": 0,
      "wind": 9.355,
      "verbruik": 10.648
    },
    {
      "t": "2026-10-22T04:15:00+02:00",
      "zon": 0,
      "wind": 9.33,
      "verbruik": 10.644
    },
    {
      "t": "2026-10-22T04:30:00+02:00",
      "zon": 0,
      "wind": 9.347,
      "verbruik": 10.639
    },
    {
      "t": "2026-10-22T04:45:00+02:00",
      "zon": 0,
      "wind": 9.378,
      "verbruik": 10.731
    },
    {
      "t": "2026-10-22T05:00:00+02:00",
      "zon": 0,
      "wind": 9.433,
      "verbruik": 10.84
    },
    {
      "t": "2026-10-22T05:15:00+02:00",
      "zon": 0,
      "wind": 9.441,
      "verbruik": 10.988
    },
    {
      "t": "2026-10-22T05:30:00+02:00",
      "zon": 0,
      "wind": 9.604,
      "verbruik": 11.218
    },
    {
      "t": "2026-10-22T05:45:00+02:00",
      "zon": 0,
      "wind": 9.449,
      "verbruik": 11.478
    },
    {
      "t": "2026-10-22T06:00:00+02:00",
      "zon": 0,
      "wind": 9.414,
      "verbruik": 11.833
    },
    {
      "t": "2026-10-22T06:15:00+02:00",
      "zon": 0,
      "wind": 9.435,
      "verbruik": 12.139
    },
    {
      "t": "2026-10-22T06:30:00+02:00",
      "zon": 0,
      "wind": 9.362,
      "verbruik": 12.558
    },
    {
      "t": "2026-10-22T06:45:00+02:00",
      "zon": 0,
      "wind": 9.385,
      "verbruik": 13.108
    },
    {
      "t": "2026-10-22T07:00:00+02:00",
      "zon": 0,
      "wind": 9.358,
      "verbruik": 13.616
    },
    {
      "t": "2026-10-22T07:15:00+02:00",
      "zon": 0,
      "wind": 9.302,
      "verbruik": 14.06
    },
    {
      "t": "2026-10-22T07:30:00+02:00",
      "zon": 0,
      "wind": 9.373,
      "verbruik": 14.446
    },
    {
      "t": "2026-10-22T07:45:00+02:00",
      "zon": 0,
      "wind": 9.509,
      "verbruik": 14.909
    },
    {
      "t": "2026-10-22T08:00:00+02:00",
      "zon": 0,
      "wind": 9.559,
      "verbruik": 15.36
    },
    {
      "t": "2026-10-22T08:15:00+02:00",
      "zon": 0,
      "wind": 9.575,
      "verbruik": 15.751
    },
    {
      "t": "2026-10-22T08:30:00+02:00",
      "zon": 0.022,
      "wind": 9.563,
      "verbruik": 16.115
    },
    {
      "t": "2026-10-22T08:45:00+02:00",
      "zon": 0.141,
      "wind": 9.561,
      "verbruik": 16.417
    },
    {
      "t": "2026-10-22T09:00:00+02:00",
      "zon": 0.421,
      "wind": 9.714,
      "verbruik": 16.651
    },
    {
      "t": "2026-10-22T09:15:00+02:00",
      "zon": 0.731,
      "wind": 9.903,
      "verbruik": 16.785
    },
    {
      "t": "2026-10-22T09:30:00+02:00",
      "zon": 1.236,
      "wind": 10.084,
      "verbruik": 16.899
    },
    {
      "t": "2026-10-22T09:45:00+02:00",
      "zon": 1.642,
      "wind": 10.187,
      "verbruik": 16.887
    },
    {
      "t": "2026-10-22T10:00:00+02:00",
      "zon": 1.947,
      "wind": 10.301,
      "verbruik": 16.914
    },
    {
      "t": "2026-10-22T10:15:00+02:00",
      "zon": 2.14,
      "wind": 10.408,
      "verbruik": 16.961
    },
    {
      "t": "2026-10-22T10:30:00+02:00",
      "zon": 2.373,
      "wind": 10.42,
      "verbruik": 17.054
    },
    {
      "t": "2026-10-22T10:45:00+02:00",
      "zon": 2.545,
      "wind": 10.549,
      "verbruik": 17.087
    },
    {
      "t": "2026-10-22T11:00:00+02:00",
      "zon": 2.788,
      "wind": 10.622,
      "verbruik": 17.16
    },
    {
      "t": "2026-10-22T11:15:00+02:00",
      "zon": 3.175,
      "wind": 10.581,
      "verbruik": 17.116
    },
    {
      "t": "2026-10-22T11:30:00+02:00",
      "zon": 3.788,
      "wind": 10.659,
      "verbruik": 17.117
    },
    {
      "t": "2026-10-22T11:45:00+02:00",
      "zon": 4.114,
      "wind": 10.587,
      "verbruik": 17.023
    },
    {
      "t": "2026-10-22T12:00:00+02:00",
      "zon": 4.3,
      "wind": 10.468,
      "verbruik": 16.978
    },
    {
      "t": "2026-10-22T12:15:00+02:00",
      "zon": 4.178,
      "wind": 10.472,
      "verbruik": 16.812
    },
    {
      "t": "2026-10-22T12:30:00+02:00",
      "zon": 4.115,
      "wind": 10.419,
      "verbruik": 16.74
    },
    {
      "t": "2026-10-22T12:45:00+02:00",
      "zon": 4.367,
      "wind": 10.362,
      "verbruik": 16.745
    },
    {
      "t": "2026-10-22T13:00:00+02:00",
      "zon": 4.998,
      "wind": 10.374,
      "verbruik": 16.777
    },
    {
      "t": "2026-10-22T13:15:00+02:00",
      "zon": 5.718,
      "wind": 10.373,
      "verbruik": 16.786
    },
    {
      "t": "2026-10-22T13:30:00+02:00",
      "zon": 6.173,
      "wind": 10.421,
      "verbruik": 16.794
    },
    {
      "t": "2026-10-22T13:45:00+02:00",
      "zon": 6.223,
      "wind": 10.352,
      "verbruik": 16.821
    },
    {
      "t": "2026-10-22T14:00:00+02:00",
      "zon": 6.317,
      "wind": 10.107,
      "verbruik": 16.767
    },
    {
      "t": "2026-10-22T14:15:00+02:00",
      "zon": 6.387,
      "wind": 10.134,
      "verbruik": 16.611
    },
    {
      "t": "2026-10-22T14:30:00+02:00",
      "zon": 6.501,
      "wind": 10.108,
      "verbruik": 16.492
    },
    {
      "t": "2026-10-22T14:45:00+02:00",
      "zon": 6.748,
      "wind": 9.955,
      "verbruik": 16.396
    },
    {
      "t": "2026-10-22T15:00:00+02:00",
      "zon": 6.553,
      "wind": 9.952,
      "verbruik": 16.388
    },
    {
      "t": "2026-10-22T15:15:00+02:00",
      "zon": 6.174,
      "wind": 9.736,
      "verbruik": 16.374
    },
    {
      "t": "2026-10-22T15:30:00+02:00",
      "zon": 5.915,
      "wind": 10.784,
      "verbruik": 16.361
    },
    {
      "t": "2026-10-22T15:45:00+02:00",
      "zon": 5.843,
      "wind": 9.553,
      "verbruik": 16.369
    },
    {
      "t": "2026-10-22T16:00:00+02:00",
      "zon": 5.32,
      "wind": 9.337,
      "verbruik": 16.332
    },
    {
      "t": "2026-10-22T16:15:00+02:00",
      "zon": 4.555,
      "wind": 9.292,
      "verbruik": 16.378
    },
    {
      "t": "2026-10-22T16:30:00+02:00",
      "zon": 4.025,
      "wind": 9.129,
      "verbruik": 16.462
    },
    {
      "t": "2026-10-22T16:45:00+02:00",
      "zon": 3.849,
      "wind": 8.967,
      "verbruik": 16.599
    },
    {
      "t": "2026-10-22T17:00:00+02:00",
      "zon": 3.648,
      "wind": 8.375,
      "verbruik": 16.737
    },
    {
      "t": "2026-10-22T17:15:00+02:00",
      "zon": 3.274,
      "wind": 7.979,
      "verbruik": 16.88
    },
    {
      "t": "2026-10-22T17:30:00+02:00",
      "zon": 2.316,
      "wind": 7.273,
      "verbruik": 17.028
    },
    {
      "t": "2026-10-22T17:45:00+02:00",
      "zon": 1.552,
      "wind": 6.693,
      "verbruik": 17.067
    },
    {
      "t": "2026-10-22T18:00:00+02:00",
      "zon": 0.782,
      "wind": 5.936,
      "verbruik": 17.062
    },
    {
      "t": "2026-10-22T18:15:00+02:00",
      "zon": 0.198,
      "wind": 5.537,
      "verbruik": 17.027
    },
    {
      "t": "2026-10-22T18:30:00+02:00",
      "zon": 0.004,
      "wind": 4.909,
      "verbruik": 17.098
    },
    {
      "t": "2026-10-22T18:45:00+02:00",
      "zon": 0,
      "wind": 4.272,
      "verbruik": 17.136
    },
    {
      "t": "2026-10-22T19:00:00+02:00",
      "zon": 0,
      "wind": 3.769,
      "verbruik": 17.147
    },
    {
      "t": "2026-10-22T19:15:00+02:00",
      "zon": 0,
      "wind": 3.457,
      "verbruik": 16.968
    },
    {
      "t": "2026-10-22T19:30:00+02:00",
      "zon": 0,
      "wind": 3.083,
      "verbruik": 16.728
    },
    {
      "t": "2026-10-22T19:45:00+02:00",
      "zon": 0,
      "wind": 2.797,
      "verbruik": 16.462
    },
    {
      "t": "2026-10-22T20:00:00+02:00",
      "zon": 0,
      "wind": 2.521,
      "verbruik": 16.303
    },
    {
      "t": "2026-10-22T20:15:00+02:00",
      "zon": 0,
      "wind": 2.292,
      "verbruik": 16.054
    },
    {